{
  "protocol": "baijin-claude-repair-handoff/1.0",
  "handoff_id": "claude-repair-handoff-001",
  "source_review_result_id": "chatgpt-review-result-changes-001",
  "invocation_id": "invocation-mcp-002",
  "repository": "shunhang776/xinbaijin-mcp",
  "branch": "dev",
  "reviewed_commit": "2222222222222222222222222222222222222222",
  "review_commit": "cccccccccccccccccccccccccccccccccccccccc",
  "verdict": "changes_requested",
  "findings": [
    {
      "severity": "medium",
      "file": "worker.js",
      "line": 12,
      "title": "Sample finding",
      "description": "Sample review finding for repair handoff validation.",
      "recommendation": "Fix the affected logic before continuing the L4 loop."
    }
  ],
  "repair_round": 0,
  "max_repair_round": 2,
  "target_actor": "claude-code",
  "forbidden_actions": [
    "do not modify review.json",
    "do not bypass ChatGPT review",
    "do not bypass gate",
    "do not push directly to dev"
  ],
  "created_at": "2026-06-27T00:00:00.000Z"
}
